{
  "$schema": "https://json-schema.org/draft/2020-12/schema",
  "$id": "https://claude.skills/qc-finding.schema.json",
  "title": "QC Finding Report",
  "type": "object",
  "additionalProperties": true,
  "required": ["schema_version", "skill", "run_id", "git_sha", "findings", "verdict"],
  "properties": {
    "schema_version": {
      "type": "string",
      "const": "1.1"
    },
    "skill": {
      "type": "string",
      "enum": ["qc-packaging", "qc-docs", "qc-hardening", "qc-coherence", "qc-deterministic", "qc-all"]
    },
    "run_id": {
      "type": "string",
      "pattern": "^\\d{4}-\\d{2}-\\d{2}T\\d{2}:\\d{2}:\\d{2}Z-[0-9a-f]{7}$"
    },
    "git_sha": {
      "type": "string",
      "pattern": "^[0-9a-f]{7,40}$"
    },
    "findings": {
      "type": "array",
      "items": {
        "type": "object",
        "additionalProperties": true,
        "required": ["id", "severity", "file", "what", "fixed"],
        "properties": {
          "id": {
            "type": "string",
            "pattern": "^[A-Z]+-?[0-9]+(\\.[0-9]+)?$"
          },
          "severity": {
            "type": "string",
            "enum": ["P0", "P1", "P2", "P3"]
          },
          "file": {
            "type": "string"
          },
          "what": {
            "type": "string",
            "minLength": 5
          },
          "fixed": {
            "type": "boolean"
          },
          "pass": {
            "type": "integer",
            "minimum": 1,
            "maximum": 14
          },
          "scope": {
            "type": "string",
            "enum": ["function", "module", "codebase"]
          },
          "line": {
            "type": "integer"
          },
          "why": {
            "type": "string"
          },
          "fix": {
            "type": "string"
          },
          "deferred_because": {
            "type": "string",
            "minLength": 1
          },
          "confidence": {
            "type": "string",
            "enum": ["mechanical", "pattern", "proven", "human"]
          },
          "scenario": {
            "type": "object",
            "additionalProperties": false,
            "required": ["trigger", "violated_invariant", "observable"],
            "properties": {
              "trigger": { "type": "string", "minLength": 8 },
              "violated_invariant": { "type": "string", "minLength": 8 },
              "observable": { "type": "string", "minLength": 8 }
            }
          },
          "related_findings": {
            "type": "array",
            "items": { "type": "string" }
          }
        }
      }
    },
    "examined": {
      "type": "array",
      "description": "Named artifacts examined with no finding. Required for LLM-assisted passes.",
      "items": {
        "type": "object",
        "additionalProperties": true,
        "required": ["artifact", "invariant"],
        "properties": {
          "artifact": { "type": "string", "minLength": 1 },
          "invariant": { "type": "string", "minLength": 1 },
          "carmack": {
            "type": "object",
            "additionalProperties": false,
            "properties": {
              "invariant": { "type": "string" },
              "assumptions_wrong": { "type": "string" },
              "invalid_sequence": { "type": "string" },
              "million_runs": { "type": "string" },
              "wrong_tomorrow": { "type": "string" }
            }
          }
        }
      }
    },
    "mode": {
      "type": "string",
      "enum": ["full", "quick-check"]
    },
    "verdict": {
      "type": "string",
      "enum": ["READY", "READY_WITH_DEBT", "NOT_READY", "SKIPPED"]
    },
    "skipped": {
      "type": "array",
      "items": {
        "type": "object",
        "required": ["skill", "last_covered_sha"],
        "properties": {
          "skill": { "type": "string" },
          "last_covered_sha": { "type": "string" }
        }
      }
    },
    "findings_by_skill": {
      "type": "object"
    },
    "skill_verdicts": {
      "type": "object"
    }
  }
}
