{
  "schema_version": "1.1",
  "skill": "qc-hardening",
  "run_id": "2026-08-25T05:27:31Z-1525929",
  "git_sha": "15259297d51f",
  "findings": [
    {
      "id": "F1.1",
      "pass": 1,
      "scope": "module",
      "severity": "P1",
      "confidence": "proven",
      "file": "skills/qc-core/scripts/verify_skills.py",
      "line": 353,
      "what": "verify_skills.py raises FileNotFoundError on check_readme_links_exist when the skill tree is vendored without the pack README",
      "why": "Landing checks assume SKILLS_DIR.parent is the GitHub pack root. A sibling-only standalone port has no README there. check_readme_docs_contract fails softly, then check_readme_links_exist reads the missing file and aborts the remaining registry.",
      "scenario": {
        "trigger": "Copy qc-core plus specializations into an agent skills directory (documented standalone port), then run python3 qc-core/scripts/verify_skills.py",
        "violated_invariant": "Skill-tree verification completes every registry check; missing pack landing files skip landing checks instead of raising",
        "observable": "FileNotFoundError for <parent>/README.md; process exits 1; later checks including core_self_test never run"
      },
      "fix": "Detect pack checkout (README.md + docs/qc-core.pdf). Skip landing checks otherwise. Never read README without exists().",
      "fixed": true
    },
    {
      "id": "F2.1",
      "pass": 2,
      "severity": "P2",
      "confidence": "mechanical",
      "file": ".gitignore",
      "line": 1,
      "what": ".gitignore did not cover .env, *.pem, or *.key",
      "fix": "Add .env, .env.*, !.env.example, *.pem, *.key",
      "fixed": true
    },
    {
      "id": "F3.1",
      "pass": 3,
      "severity": "P2",
      "confidence": "mechanical",
      "file": "skills/qc-core/scripts/suite_rollup.py",
      "line": 42,
      "what": "suite_rollup.py raised JSONDecodeError on a truncated ledger; verify_ledger.py reports FAIL on the same input",
      "fix": "Catch OSError/ValueError on ledger and skipped-list reads; print FAIL and exit 1",
      "fixed": true
    },
    {
      "id": "F4.1",
      "pass": 4,
      "severity": "P2",
      "confidence": "mechanical",
      "file": "skills/qc-core/scripts/test_core.py",
      "line": 70,
      "what": "ruff F601 repeated dict key 'fixed' in a discarded setup object; F841 unused ts_groups",
      "fix": "Remove the dead dict and unused assignment",
      "fixed": true
    },
    {
      "id": "F12.1",
      "pass": 12,
      "scope": "module",
      "severity": "P1",
      "confidence": "proven",
      "file": "skills/qc-core/scripts/partition.py",
      "line": 334,
      "what": "After suite_rollup fail-closed on bad JSON, the same json.loads pattern still traceback'd in render_profile, verify_port, partition, and write_ledger",
      "why": "Pass 3 fixed one CLI. The other ingest paths still assumed well-formed JSON.",
      "scenario": {
        "trigger": "Feed truncated JSON to render_profile.py, verify_port.py --expected, partition.py --profile, or write_ledger.py <src.json> after suite_rollup already fail-closes on the same class of input",
        "violated_invariant": "Every JSON ingest CLI fail-closes with FAIL and exit 1; none traceback",
        "observable": "JSONDecodeError (and on partition, NameError: sys) on stderr; dest files may be untouched or the process aborts mid-registry"
      },
      "fix": "Catch OSError/ValueError on those CLIs; import sys in partition.py; chaos tests assert no Traceback",
      "fixed": true,
      "related_findings": [
        "F3.1",
        "F13.1"
      ]
    },
    {
      "id": "F13.1",
      "pass": 13,
      "scope": "module",
      "severity": "P1",
      "confidence": "proven",
      "file": "skills/qc-core/scripts/partition.py",
      "line": 337,
      "what": "partition.py --reexam --profile <truncated.json> raised NameError: sys is not defined while handling JSONDecodeError",
      "why": "The fail-closed print used sys.stderr but partition.py did not import sys.",
      "scenario": {
        "trigger": "Write truncated JSON to a profile file and run partition.py --reexam --profile on it (production-shaped: operator passes a half-written .qc-profile.json)",
        "violated_invariant": "Error handlers do not introduce a second exception; fail-closed uses imported names only",
        "observable": "Traceback chaining JSONDecodeError into NameError; exit 1 without the FAIL: unreadable profile line completing"
      },
      "fix": "import sys; chaos test covers partition.py --profile bad.json",
      "fixed": true,
      "related_findings": [
        "F12.1",
        "F3.1"
      ]
    }
  ],
  "examined": [
    {
      "artifact": "skills/qc-core/scripts/qc.py",
      "invariant": "compute_verdict is the only verdict algorithm; presence P0 blocks even when fixed; atomic_write_json uses temp+fsync+replace so readers never see a partial ledger"
    },
    {
      "artifact": "skills/qc-core/scripts/verify_skills.py",
      "invariant": "Landing-doc checks run only on the GitHub pack checkout; a vendored sibling layout skips them and still completes skill-contract checks"
    },
    {
      "artifact": "skills/qc-core/scripts/partition.py",
      "invariant": "reexam_set is changed files plus import-graph neighbors that already sit in hot_spots or pass_debt; language boundaries never mix in one group"
    },
    {
      "artifact": "skills/qc-core/scripts/write_ledger.py",
      "invariant": "write_ledger.py delegates to qc.atomic_write_json; dest parent is created; JSON is the full object not a patch"
    },
    {
      "artifact": "skills/qc-core/scripts/suite_rollup.py",
      "invariant": "suite_verdict is computed from per-skill ledgers via qc.suite_verdict; missing non-skipped ledgers fail closed"
    },
    {
      "artifact": ".gitignore",
      "invariant": "Secret-bearing filenames (.env, *.pem, *.key) are gitignored; planted fixture secrets stay in skills/qc-core/fixtures/"
    },
    {
      "artifact": "skills/qc-core/scripts/suite_rollup.py",
      "invariant": "Unreadable or non-JSON ledgers fail closed with FAIL on stderr and exit 1; they do not traceback"
    },
    {
      "artifact": "skills/qc-core/scripts/test_core.py",
      "invariant": "test_core.py is ruff-clean; suite algebra fixtures do not rely on duplicate dict keys"
    },
    {
      "artifact": "skills/qc-core/scripts/render_profile.py",
      "invariant": "Unreadable profile JSON prints FAIL and exits 1; markdown is not written"
    },
    {
      "artifact": "skills/qc-core/scripts/verify_port.py",
      "invariant": "Unreadable expected/ledger/profile prints FAIL and exits 1"
    },
    {
      "artifact": "skills/qc-core/scripts/partition.py",
      "invariant": "Unreadable --profile JSON prints FAIL on stderr and exits 1 without NameError"
    },
    {
      "artifact": "skills/qc-core/scripts/write_ledger.py",
      "invariant": "Unreadable stdin or src JSON prints FAIL and does not replace dest"
    }
  ],
  "verdict": "READY_WITH_DEBT"
}
